{
  "$schema": "../schemas/source.schema.v1.json",
  "schemaVersion": "1.3.0",
  "registryVersion": "1.19.0",
  "generatedDataPolicy": "artifact-only",
  "sources": [
    {
      "id": "synthetic-federal",
      "name": "Synthetic Federal Source",
      "provider": "Synthetic Public Agency",
      "synthetic": true,
      "enabled": true,
      "adapter": {
        "id": "synthetic-adapter",
        "version": "1.0.0",
        "module": "fixtures/records/general-jurisdiction.valid.json",
        "identityRule": "fixture-assigned-id-v1"
      },
      "jurisdiction": {
        "level": "federal",
        "name": "United States",
        "stateCode": null
      },
      "access": {
        "method": "fixture",
        "officialDocumentationUrl": "https://official.example.invalid/docs",
        "allowedHosts": ["official.example.invalid"],
        "authentication": "none",
        "rateLimit": "No network access. Committed synthetic fixture only.",
        "browserRuntimeAllowed": false
      },
      "coverage": {
        "from": "2020-01-01",
        "through": null,
        "cadence": "Synthetic build only.",
        "limitations": "Contract-test records only. This is not public policy coverage."
      },
      "publication": {
        "attribution": "Synthetic Public Agency",
        "termsUrl": "https://official.example.invalid/terms",
        "reproduction": "reviewed_excerpt",
        "failureMode": "last_known_good",
        "requiredProvenancePointers": [
          "/officialTitle",
          "/sourceDocumentIdentifier",
          "/documentType",
          "/jurisdiction/name",
          "/status/sourceLabel",
          "/urls/officialSource"
        ]
      },
      "officialSubjectMappings": []
    },
    {
      "id": "synthetic-county",
      "name": "Synthetic County Records",
      "provider": "Example County",
      "synthetic": true,
      "enabled": true,
      "adapter": {
        "id": "synthetic-county-adapter",
        "version": "1.0.0",
        "module": "fixtures/records/county-explicit.valid.json",
        "identityRule": "fixture-assigned-id-v1"
      },
      "jurisdiction": {
        "level": "county",
        "name": "Example County",
        "stateCode": "WA"
      },
      "access": {
        "method": "fixture",
        "officialDocumentationUrl": "https://county.example.invalid/docs",
        "allowedHosts": ["county.example.invalid"],
        "authentication": "none",
        "rateLimit": "No network access. Committed synthetic fixture only.",
        "browserRuntimeAllowed": false
      },
      "coverage": {
        "from": "2025-01-01",
        "through": null,
        "cadence": "Synthetic build only.",
        "limitations": "Contract-test records only. The explicit Nation mention is fictional."
      },
      "publication": {
        "attribution": "Example County",
        "termsUrl": "https://county.example.invalid/terms",
        "reproduction": "reviewed_excerpt",
        "failureMode": "last_known_good",
        "requiredProvenancePointers": [
          "/officialTitle",
          "/sourceDocumentIdentifier",
          "/documentType",
          "/jurisdiction/name",
          "/status/sourceLabel",
          "/urls/officialSource",
          "/nationAssociations/0"
        ]
      },
      "officialSubjectMappings": []
    },
    {
      "id": "synthetic-state-accord",
      "name": "Synthetic State Accord Source",
      "provider": "Synthetic State Archive",
      "synthetic": true,
      "enabled": true,
      "adapter": {
        "id": "synthetic-state-accord-adapter",
        "version": "1.0.0",
        "module": "fixtures/records/intergovernmental-accord.valid.json",
        "identityRule": "synthetic-accord-title-execution-url-v1"
      },
      "jurisdiction": {
        "level": "state",
        "name": "Synthetic State",
        "stateCode": "WA"
      },
      "access": {
        "method": "fixture",
        "officialDocumentationUrl": "https://accord.example.invalid/docs",
        "allowedHosts": ["accord.example.invalid"],
        "authentication": "none",
        "rateLimit": "No network access. Committed synthetic fixture only.",
        "browserRuntimeAllowed": false
      },
      "coverage": {
        "from": "1974-08-04",
        "through": "1974-08-04",
        "cadence": "Synthetic build only.",
        "limitations": "One fictional metadata-only historical accord for contract testing. It names no real government, person, or Nation."
      },
      "publication": {
        "attribution": "Synthetic State Archive",
        "termsUrl": "https://accord.example.invalid/terms",
        "reproduction": "metadata_and_links",
        "failureMode": "last_known_good",
        "requiredProvenancePointers": [
          "/officialTitle",
          "/sourceDocumentIdentifier",
          "/documentType",
          "/jurisdiction/name",
          "/accordContext/parties/0/officialName",
          "/accordContext/parties/1/officialName",
          "/accordContext/executionEvent/date",
          "/accordContext/statusReview/sourceLabel",
          "/urls/officialSource"
        ]
      },
      "officialSubjectMappings": []
    },
    {
      "id": "federal-register",
      "name": "Federal Register",
      "provider": "Office of the Federal Register",
      "synthetic": false,
      "enabled": false,
      "adapter": {
        "id": "federal-register-adapter",
        "version": "1.0.0",
        "module": "src/adapters/federal-register/index.ts",
        "identityRule": "federal-register-document-number-v1"
      },
      "jurisdiction": {
        "level": "federal",
        "name": "United States",
        "stateCode": null
      },
      "access": {
        "method": "api",
        "officialDocumentationUrl": "https://www.federalregister.gov/developers/documentation/api/v1",
        "accessedOn": "2026-07-31",
        "allowedHosts": ["www.federalregister.gov", "www.govinfo.gov"],
        "authentication": "none",
        "rateLimit": "No numeric request-rate limit was published on 2026-07-31. The documented page-size maximum is 1,000 and the observed search window is 10,000 results, so retrieval must use deterministic date slicing.",
        "browserRuntimeAllowed": false
      },
      "coverage": {
        "from": "1994-01-03",
        "through": null,
        "cadence": "Federal Register issues are published on federal business days; Policy Sentinel retrieval is build-time only.",
        "limitations": "The API documents coverage since 1994. The first observed issue is 1994-01-03; early records may lack individual PDFs, and API HTML/XML renditions are informational rather than the official edition. The historical Uncategorized Document type is reconciled for source completeness but is not an eligible public-record candidate; no missing issuing body is inferred."
      },
      "publication": {
        "attribution": "Office of the Federal Register and the issuing agency; link the official PDF on GovInfo when available.",
        "termsUrl": "https://www.federalregister.gov/reader-aids/government-policy-and-ofr-procedures/about-this-site",
        "reproduction": "reviewed_excerpt",
        "failureMode": "last_known_good",
        "requiredProvenancePointers": [
          "/officialTitle",
          "/sourceDocumentIdentifier",
          "/documentType",
          "/jurisdiction/name",
          "/status/sourceLabel",
          "/urls/officialSource"
        ]
      },
      "officialSubjectMappings": []
    },
    {
      "id": "grants-gov",
      "name": "Grants.gov",
      "provider": "U.S. Department of Health and Human Services",
      "synthetic": false,
      "enabled": false,
      "adapter": null,
      "jurisdiction": {
        "level": "federal",
        "name": "United States",
        "stateCode": null
      },
      "access": {
        "method": "api",
        "officialDocumentationUrl": "https://www.grants.gov/api/api-guide",
        "accessedOn": "2026-07-31",
        "allowedHosts": ["api.grants.gov", "www.grants.gov"],
        "authentication": "none",
        "rateLimit": "The common search and opportunity routes require no authentication, but access or use accepts the current API terms and remains prohibited until G-B-GRANTS approval. No numeric request limit was published on 2026-07-31; 429 with exponential backoff is documented.",
        "browserRuntimeAllowed": false
      },
      "coverage": {
        "from": null,
        "through": null,
        "cadence": "Opportunities change throughout their lifecycle; the separate active-database XML snapshot is published daily. Any approved Policy Sentinel retrieval would remain build-time only.",
        "limitations": "The sample-only REST documentation does not guarantee historical completeness, stable pagination, a canonical opportunity URL field, or reliable current-deadline and time-zone semantics. No REST request or XML-body retrieval was made."
      },
      "publication": {
        "attribution": "This product uses the Grants.gov API but is not endorsed or certified by the U.S. Department of Health and Human Services.",
        "termsUrl": "https://www.grants.gov/api/terms-conditions",
        "reproduction": "metadata_and_links",
        "failureMode": "last_known_good",
        "requiredProvenancePointers": [
          "/officialTitle",
          "/sourceDocumentIdentifier",
          "/documentType",
          "/jurisdiction/name",
          "/status/sourceLabel",
          "/dates/deadline",
          "/urls/officialSource"
        ]
      },
      "officialSubjectMappings": []
    },
    {
      "id": "congress-gov",
      "name": "Congress.gov",
      "provider": "Library of Congress",
      "synthetic": false,
      "enabled": false,
      "adapter": null,
      "jurisdiction": {
        "level": "federal",
        "name": "United States",
        "stateCode": null
      },
      "access": {
        "method": "api",